<?xml version="1.0" encoding="utf-8"?>

<database xmlns:xsi="http://www.w3.org/2001/XMLSchema-instance" xsi:noNamespaceSchemaLocation="file:///D:/IT/Final%20Project/DatabaseQAConfig/config.xsd">
    <table table-alias="Publication"> <!-- Tên do người dùng đặt thay thế cho dblp_pub_new -->
        <table-name>dblp_pub_new</table-name>
        <field type="String" field-alias="author" visible="false" relation="related table">
            <!--Thông tin này không được hiển thị cho người dùng-->
            <relation>
                <relation-name>has author</relation-name> 
                <relation-name>has writer</relation-name>
                <relation-name>has composer</relation-name>
                <relation-name>be write</relation-name>
                <relation-name>be compose</relation-name>
                <reversed-relation>write</reversed-relation>
                <reversed-relation>compose</reversed-relation>
                <reversed-relation>has write</reversed-relation>
                <reversed-relation>has compose</reversed-relation> 
                <related-table>author</related-table>               
            </relation>
            <field-name>author</field-name>
        </field>
        
        <field type="String" field-alias="title" visible="true" relation="has attribute">
            <relation>
                <relation-name>has title</relation-name>
                <relation-name>has heading</relation-name>
            </relation>
            <field-name>title</field-name>
        </field>
        
        <field type="String" field-alias="source" visible="true" relation="has attribute">
            <relation>
                <relation-name>has source</relation-name>
                <relation-name>from</relation-name>
                <relation-name>in</relation-name>
                <relation-name>result from</relation-name>
            </relation>
            <field-name>source</field-name>
        </field>
              
        <field type="Int" field-alias="year" visible="true" relation="has attribute">
            <relation>
                <relation-name>has year</relation-name>
                <relation-name>in</relation-name>
                <relation-name>from</relation-name>
                <relation-name>to</relation-name>
            </relation>
            <field-name>year</field-name>
        </field>
        
        <field type="String" field-alias="type" visible="true" relation="has attribute">
            <relation>
                <relation-name>has type</relation-name>
            </relation>
            <field-name>type</field-name>
        </field>

        <field type="String" field-alias="isbn" visible="true" relation="has attribute">
            <relation>
                <relation-name>have</relation-name>
                <relation-name>has</relation-name>
            </relation>
            <field-name>isbn</field-name>
        </field>

        <field type="String" field-alias="doi" visible="true" relation="has attribute">
            <relation>
                <relation-name>have</relation-name>
                <relation-name>has</relation-name>
            </relation>
            <field-name>isbn</field-name>
        </field>
        
        <field type="String" field-alias="publisher" visible="true" relation="has attribute">
            <relation>
                <relation-name>has publisher</relation-name>
                <relation-name>be publish</relation-name>
                <relation-name>be release</relation-name>
                <reversed-relation>publish</reversed-relation>
                <reversed-relation>has publish</reversed-relation>
                <reversed-relation>release</reversed-relation>
                <reversed-relation>has release</reversed-relation>
            </relation>
            <field-name>publisher</field-name>
        </field>
        
        <primary-key>id</primary-key>
        
    </table>
    
    <database-name>dblp</database-name> 	
 
    <related-table>
        <name>author</name>
        <related-table-name>dblp_author_ref_new</related-table-name> 
        <table-key>pub_id</table-key>
    </related-table>
</database>
